{
    "limitClass": "PairProductionLimit",
    "id": 130160651,
    "reference": "1301.6065",
    "source": "Fig 4(bottom-right)",
    "citeKey": "ALEPH:2013htx",
    "collider": "LEP",
    "experiment": "LEPComb",
    "luminosity": 2.6,
    "process": {
        "firstDecay": [
            "cs"
        ],
        "secondDecay": [
            "cs"
        ]
    },
    "analysis": {
        "equalParticleMasses": true,
        "massResolution": {
            "absolute": 3,
            "relative": 0
        },
        "grid": {
            "massFirstParticle": [
                43.0,
                43.5,
                44.0,
                44.5,
                45.0,
                45.5,
                46.0,
                47.0,
                47.5,
                48.0,
                49.0,
                49.5,
                50.0,
                51.0,
                51.5,
                52.0,
                52.5,
                53.0,
                53.5,
                54.0,
                54.5,
                55.0,
                55.5,
                56.0,
                56.5,
                57.0,
                58.0,
                58.5,
                59.0,
                60.0,
                60.5,
                61.0,
                61.5,
                62.0,
                63.0,
                63.5,
                64.0,
                64.5,
                65.0,
                65.5,
                66.0,
                66.5,
                67.0,
                68.0,
                68.5,
                69.0,
                69.5,
                70.0,
                70.5,
                71.0,
                71.5,
                72.0,
                72.5,
                73.0,
                73.5,
                74.0,
                74.5,
                75.0,
                75.5,
                76.0,
                76.5,
                77.0,
                77.5,
                78.0,
                78.5,
                79.0,
                79.5,
                80.0,
                80.5,
                81.0,
                81.5,
                82.0,
                82.5,
                83.0,
                83.5,
                84.0,
                84.5,
                85.0,
                85.5,
                86.0,
                86.5,
                87.0,
                87.5,
                88.0,
                88.5,
                89.0,
                89.5,
                90.0,
                90.5,
                91.0,
                91.5,
                92.0,
                92.5,
                93.0,
                93.5,
                94.0,
                94.5,
                95.0
            ]
        },
        "limit": {
            "observed": [
                0.20947,
                0.2096,
                0.20352,
                0.17574,
                0.14193,
                0.12072,
                0.09919,
                0.08193,
                0.08114,
                0.08108,
                0.07797,
                0.08243,
                0.08697,
                0.08856,
                0.09331,
                0.09815,
                0.11867,
                0.1396,
                0.16381,
                0.18851,
                0.1788,
                0.16554,
                0.152,
                0.14248,
                0.13276,
                0.12283,
                0.11906,
                0.11712,
                0.11576,
                0.11953,
                0.11578,
                0.11194,
                0.10312,
                0.09408,
                0.08442,
                0.08662,
                0.0962,
                0.11508,
                0.1345,
                0.15178,
                0.16959,
                0.18119,
                0.19316,
                0.21592,
                0.20269,
                0.18902,
                0.1935,
                0.19813,
                0.20743,
                0.21707,
                0.21841,
                0.21981,
                0.21435,
                0.20868,
                0.18408,
                0.16729,
                0.18725,
                0.21877,
                0.21726,
                0.22048,
                0.27122,
                0.32431,
                0.37049,
                0.4189,
                0.45173,
                0.4862,
                0.59896,
                0.71768,
                0.8518,
                0.99334,
                1.11026,
                1.17322,
                1.08348,
                0.88439,
                0.7937,
                0.75338,
                0.78378,
                0.83452,
                0.76641,
                0.69453,
                0.61702,
                0.59251,
                0.6512,
                0.77552,
                0.91034,
                1.11254,
                1.21293,
                1.29884,
                1.50842,
                1.74775,
                1.87456,
                1.94424,
                2.02069,
                2.02591,
                1.81523,
                1.46205,
                1.44761,
                1.59323
            ],
            "expected": [
                0.08324,
                0.08453,
                0.08584,
                0.08717,
                0.08713,
                0.08426,
                0.08135,
                0.08314,
                0.08406,
                0.08501,
                0.08696,
                0.07713,
                0.06714,
                0.07225,
                0.0739,
                0.07559,
                0.07732,
                0.07908,
                0.08068,
                0.08232,
                0.07609,
                0.06974,
                0.0715,
                0.0733,
                0.07514,
                0.07703,
                0.08095,
                0.08299,
                0.08507,
                0.08941,
                0.09208,
                0.09481,
                0.09763,
                0.10052,
                0.10655,
                0.10969,
                0.11293,
                0.11561,
                0.11836,
                0.12121,
                0.12414,
                0.12858,
                0.13315,
                0.14277,
                0.14782,
                0.15305,
                0.15846,
                0.16406,
                0.17134,
                0.17889,
                0.18672,
                0.19484,
                0.20329,
                0.2146,
                0.22636,
                0.23861,
                0.25136,
                0.26466,
                0.29463,
                0.32593,
                0.36109,
                0.39787,
                0.45777,
                0.52056,
                0.58644,
                0.65563,
                0.73594,
                0.82049,
                0.8787,
                0.91142,
                0.91012,
                0.86961,
                0.83327,
                0.79457,
                0.7735,
                0.75093,
                0.74573,
                0.74004,
                0.75146,
                0.76356,
                0.77931,
                0.7961,
                0.82191,
                0.84961,
                0.90175,
                0.95822,
                1.02893,
                1.10598,
                1.19227,
                1.2869,
                1.35894,
                1.43821,
                1.50526,
                1.57934,
                1.6543,
                1.73773,
                1.83109,
                1.93617
            ]
        }
    }
}