{
    "limitClass": "PairProductionLimit",
    "id": 141202372,
    "reference": "1412.0237",
    "source": "Fig. 10(c)",
    "citeKey": "ATLAS:2014kca",
    "collider": "LHC8",
    "experiment": "ATLAS",
    "luminosity": 20.3,
    "process": {
        "firstDecay": [
            "mumusamesign"
        ],
        "secondDecay": [
            "mumusamesign"
        ]
    },
    "analysis": {
        "equalParticleMasses": true,
        "grid": {
            "massFirstParticle": [
                49.6907216494845,
                52.9896907216495,
                56.9072164948453,
                60.0,
                64.9484536082474,
                68.6597938144329,
                73.8144329896907,
                78.9690721649484,
                84.9484536082474,
                90.9278350515463,
                97.7319587628866,
                105.979381443299,
                113.814432989691,
                121.855670103093,
                132.164948453608,
                142.886597938144,
                154.020618556701,
                167.01030927835,
                180.824742268041,
                196.907216494845,
                214.845360824742,
                234.639175257732,
                256.907216494845,
                282.886597938144,
                311.958762886598,
                383.917525773196,
                429.072164948454,
                482.886597938144,
                546.391752577319,
                613.19587628866
            ]
        },
        "limit": {
            "observed": [
                1.43805420184307,
                2.76403603285579,
                3.02089902388162,
                2.72102954673638,
                2.17328615138066,
                3.37139243212813,
                4.58931654209824,
                2.04115103665795,
                2.40021262747292,
                2.19612576799276,
                1.63881127933833,
                2.12831704103069,
                1.9070550228713,
                1.59653412799103,
                1.59653412799103,
                1.43055680581135,
                1.65603396365715,
                1.33657455672274,
                0.677444945519431,
                0.931865016329942,
                0.763989519092513,
                0.884405698785044,
                0.917365842146403,
                0.616611117423495,
                0.564181501382351,
                0.663427418885058,
                0.354303717718722,
                0.391298797302338,
                0.280039355352202,
                0.298167867981488
            ],
            "expected": [
                2.48966405503369,
                2.77852205165634,
                2.58244916970259,
                2.54226804939492,
                2.3261024079767,
                2.55559180578661,
                2.51582856745836,
                3.42467805043724,
                1.89711245829871,
                1.647400114911,
                1.54723870586705,
                1.45316707900225,
                1.38638618623085,
                1.30209434198787,
                1.14857381300723,
                1.10730657174038,
                1.01315377955791,
                0.961554474826807,
                0.834987375362759,
                0.830634110356099,
                0.744280537995272,
                0.717539196530025,
                0.663427418885067,
                0.570110628194774,
                0.50027113843267,
                0.418813267670773,
                0.381204286308826,
                0.317469940554654,
                0.244452921910488,
                0.204649277465321
            ]
        }
    }
}