{
    "limitClass": "PairProductionLimit",
    "id": 1710097483,
    "reference": "1710.09748",
    "source": "Fig. 10(c)",
    "citeKey": "ATLAS:2017xqs",
    "collider": "LHC13",
    "experiment": "ATLAS",
    "luminosity": 36.1,
    "process": {
        "firstDecay": [
            "emusamesign"
        ],
        "secondDecay": [
            "emusamesign"
        ]
    },
    "analysis": {
        "equalParticleMasses": true,
        "grid": {
            "massFirstParticle": [
                250.0,
                300.0,
                350.0,
                400.0,
                450.0,
                500.0,
                550.0,
                600.0,
                650.0,
                700.0,
                750.0,
                800.0,
                850.0,
                900.0,
                950.0,
                1000.0,
                1050.0,
                1100.0,
                1150.0,
                1200.0
            ]
        },
        "limit": {
            "observed": [
                0.272294,
                0.143716,
                0.108805,
                0.105896,
                0.106131,
                0.11102,
                0.123134,
                0.117283,
                0.0944195,
                0.0894191,
                0.0881255,
                0.0896223,
                0.0894858,
                0.0903511,
                0.0927078,
                0.0957511,
                0.0986763,
                0.100678,
                0.101636,
                0.104162
            ],
            "expected": [
                0.206282,
                0.161448,
                0.140529,
                0.136355,
                0.1258,
                0.128059,
                0.124089,
                0.118901,
                0.11023,
                0.105381,
                0.105124,
                0.107248,
                0.10767,
                0.109031,
                0.111663,
                0.114762,
                0.117525,
                0.119147,
                0.119587,
                0.121854
            ]
        }
    }
}