{
    "limitClass": "PairProductionLimit",
    "id": 210111961,
    "reference": "2101.11961",
    "source": "https://www.hepdata.net/record/ins1688938",
    "citeKey": "ATLAS:2021jol",
    "collider": "LHC13",
    "experiment": "ATLAS",
    "luminosity": 139.0,
    "process": {
        "firstDecay": [
            "WWsamesign"
        ],
        "secondDecay": [
            "WWsamesign"
        ]
    },
    "analysis": {
        "equalParticleMasses": true,
        "grid": {
            "massFirstParticle": [
                200.0,
                300.0,
                350.0,
                400.0,
                500.0,
                600.0
            ]
        },
        "limit": {
            "observed": [
                15.025,
                9.6896,
                8.7162,
                7.4858,
                5.5951,
                4.8339
            ],
            "expected": [
                15.111,
                9.4993,
                8.5383,
                6.8682,
                4.8541,
                4.2192
            ]
        }
    }
}