{
    "limitClass": "PairProductionLimit",
    "id": 14120237,
    "reference": "1412.0237",
    "source": "Fig. 4(a)",
    "citeKey": "ATLAS:2014kca",
    "collider": "LHC8",
    "experiment": "ATLAS",
    "luminosity": 20.3,
    "process": {
        "firstDecay": [
            "eesamesign"
        ],
        "secondDecay": [
            "eesamesign"
        ]
    },
    "analysis": {
        "equalParticleMasses": true,
        "grid": {
            "massFirstParticle": [
                50.1030927835051,
                53.1958762886598,
                56.0824742268041,
                58.9690721649485,
                61.8556701030928,
                65.1546391752577,
                68.0412371134021,
                69.0,
                112.0,
                113.40206185567,
                118.144329896907,
                123.298969072165,
                129.278350515464,
                135.051546391753,
                140.20618556701,
                147.835051546392,
                155.257731958763,
                162.268041237113,
                169.896907216495,
                178.350515463918,
                185.979381443299,
                194.639175257732,
                204.123711340206,
                215.051546391753,
                222.886597938144,
                232.989690721649,
                243.917525773196,
                255.051546391753,
                266.80412371134,
                280.0,
                293.19587628866,
                300.000000000001,
                307.216494845361,
                321.855670103093,
                336.907216494845,
                352.989690721649,
                369.896907216495,
                387.628865979381,
                407.422680412371,
                426.80412371134,
                448.041237113402,
                470.103092783505,
                493.814432989691,
                519.381443298969,
                545.979381443299,
                573.60824742268,
                603.711340206185,
                610.721649484536
            ]
        },
        "limit": {
            "observed": [
                10.9097582227046,
                8.16140079325182,
                11.9022824477871,
                11.1229116445837,
                14.304154254852,
                16.9430501625222,
                11.1229116445837,
                1000000.0,
                1000000.0,
                4.1062499172443,
                3.87467512045613,
                4.33066531720584,
                3.96953372274846,
                3.17761180566086,
                2.96953928880449,
                2.78854817172629,
                3.60348475511829,
                2.61858832289389,
                1.90288159123103,
                1.70252084117965,
                1.60650600385373,
                1.3694766186266,
                1.17308027169156,
                1.05976624867607,
                0.971392974108775,
                1.60650600385373,
                1.22527985738287,
                1.01461790254339,
                1.36286795935578,
                1.68612883828689,
                1.24319087892647,
                0.962040327106479,
                0.737304795871685,
                1.26136372203745,
                0.705894008661876,
                0.576108392224475,
                0.824074330989369,
                0.751710160041978,
                0.562341325190351,
                0.422717687557056,
                0.374566913006292,
                0.422717687557054,
                0.298393883001927,
                0.250703076750966,
                0.199719361093159,
                0.340026374648184,
                0.325540511868505,
                0.295520923520287
            ],
            "expected": [
                11.3402296299968,
                10.0484908257287,
                10.2944948816155,
                11.015819387359,
                13.4323271444295,
                12.1936704589071,
                10.857111194022,
                1000000.0,
                1000000.0,
                5.12960629473252,
                5.10485244371067,
                4.47981937991362,
                3.83736944745241,
                3.76383218896516,
                3.40026374648183,
                2.88458960148464,
                2.44712110276819,
                2.12682174729621,
                2.09617999245313,
                1.98755578879352,
                1.73578446954885,
                1.56811587424569,
                1.56811587424569,
                1.41664327466902,
                1.34974616078987,
                1.40300372319058,
                1.31749173414821,
                1.19022824477872,
                1.21936704589071,
                1.15617935456386,
                1.02944948816155,
                0.93451921456054,
                0.848342898244074,
                0.737304795871683,
                0.804381705940068,
                0.709316946997569,
                0.726682225913272,
                0.63463059962866,
                0.404708995075977,
                0.420677786235032,
                0.461174776770828,
                0.3177611805661,
                0.288458960148466,
                0.234286842373225,
                0.208606449347197,
                0.266974995728804,
                0.28845896014847,
                0.266974995728795
            ]
        }
    }
}