{
    "limitClass": "PairProductionLimit",
    "id": 130160652,
    "reference": "1301.6065",
    "source": "Fig 4(top-left)",
    "citeKey": "ALEPH:2013htx",
    "collider": "LEP",
    "experiment": "LEPComb",
    "luminosity": 2.6,
    "process": {
        "firstDecay": [
            "taunu"
        ],
        "secondDecay": [
            "taunu"
        ]
    },
    "analysis": {
        "equalParticleMasses": true,
        "massResolution": {
            "absolute": 3,
            "relative": 0
        },
        "grid": {
            "massFirstParticle": [
                43.0,
                43.5,
                44.0,
                44.5,
                45.0,
                45.5,
                46.0,
                47.0,
                47.5,
                48.0,
                49.0,
                49.5,
                50.0,
                51.0,
                51.5,
                52.0,
                52.5,
                53.0,
                53.5,
                54.0,
                54.5,
                55.0,
                55.5,
                56.0,
                56.5,
                57.0,
                58.0,
                58.5,
                59.0,
                60.0,
                60.5,
                61.0,
                61.5,
                62.0,
                63.0,
                63.5,
                64.0,
                64.5,
                65.0,
                65.5,
                66.0,
                66.5,
                67.0,
                68.0,
                68.5,
                69.0,
                69.5,
                70.0,
                70.5,
                71.0,
                71.5,
                72.0,
                72.5,
                73.0,
                73.5,
                74.0,
                74.5,
                75.0,
                75.5,
                76.0,
                76.5,
                77.0,
                77.5,
                78.0,
                78.5,
                79.0,
                79.5,
                80.0,
                80.5,
                81.0,
                81.5,
                82.0,
                82.5,
                83.0,
                83.5,
                84.0,
                84.5,
                85.0,
                85.5,
                86.0,
                86.5,
                87.0,
                87.5,
                88.0,
                88.5,
                89.0,
                89.5,
                90.0,
                90.5,
                91.0,
                91.5,
                92.0,
                92.5,
                93.0,
                93.5,
                94.0,
                94.5,
                95.0
            ]
        },
        "limit": {
            "observed": [
                0.12895,
                0.12919,
                0.12945,
                0.12065,
                0.11172,
                0.1124,
                0.1131,
                0.11455,
                0.11476,
                0.11498,
                0.11545,
                0.10209,
                0.0885,
                0.09089,
                0.09213,
                0.0934,
                0.0895,
                0.08554,
                0.0872,
                0.0889,
                0.08981,
                0.09075,
                0.09044,
                0.09012,
                0.09458,
                0.09914,
                0.09423,
                0.09488,
                0.09555,
                0.08753,
                0.09529,
                0.10326,
                0.10117,
                0.09903,
                0.10578,
                0.10415,
                0.10247,
                0.10341,
                0.10437,
                0.11029,
                0.11638,
                0.11423,
                0.11201,
                0.11917,
                0.11814,
                0.11707,
                0.11597,
                0.11484,
                0.11752,
                0.1203,
                0.11853,
                0.11669,
                0.11755,
                0.11844,
                0.12152,
                0.12473,
                0.12808,
                0.13157,
                0.13364,
                0.1358,
                0.13806,
                0.14042,
                0.14118,
                0.14197,
                0.15357,
                0.16575,
                0.16155,
                0.15711,
                0.16737,
                0.17819,
                0.18961,
                0.20168,
                0.21055,
                0.21995,
                0.22991,
                0.24049,
                0.25111,
                0.26243,
                0.2745,
                0.28739,
                0.30705,
                0.32816,
                0.33667,
                0.34577,
                0.35727,
                0.36965,
                0.38303,
                0.39752,
                0.42773,
                0.46085,
                0.48583,
                0.5133,
                0.56159,
                0.6154,
                0.67274,
                0.73722,
                0.83005,
                0.93594
            ],
            "expected": [
                0.12008,
                0.1206,
                0.12114,
                0.11855,
                0.11594,
                0.11647,
                0.11703,
                0.11818,
                0.11805,
                0.11793,
                0.1177,
                0.09831,
                0.07858,
                0.07943,
                0.07988,
                0.08034,
                0.08081,
                0.0813,
                0.0818,
                0.08232,
                0.08316,
                0.08403,
                0.08492,
                0.08583,
                0.08655,
                0.0873,
                0.08885,
                0.08979,
                0.09076,
                0.09278,
                0.09383,
                0.09492,
                0.09604,
                0.09719,
                0.09961,
                0.10087,
                0.10218,
                0.10352,
                0.10491,
                0.10635,
                0.10783,
                0.10936,
                0.11095,
                0.11428,
                0.11604,
                0.11786,
                0.11974,
                0.12169,
                0.12371,
                0.12581,
                0.12799,
                0.13026,
                0.13253,
                0.13489,
                0.13734,
                0.1399,
                0.14256,
                0.14533,
                0.14823,
                0.15125,
                0.1544,
                0.1577,
                0.16115,
                0.16476,
                0.17018,
                0.17588,
                0.18186,
                0.18815,
                0.19477,
                0.20174,
                0.20909,
                0.21686,
                0.22507,
                0.23377,
                0.24298,
                0.25276,
                0.26443,
                0.27686,
                0.29012,
                0.3043,
                0.31947,
                0.33576,
                0.35326,
                0.37212,
                0.39462,
                0.419,
                0.44546,
                0.47427,
                0.50573,
                0.54019,
                0.57806,
                0.61983,
                0.66672,
                0.71887,
                0.77713,
                0.84254,
                0.91638,
                1.00024
            ]
        }
    }
}