{
    "limitClass": "PairProductionLimit",
    "id": 141202373,
    "reference": "1412.0237",
    "source": "Fig. 10(b)",
    "citeKey": "ATLAS:2014kca",
    "collider": "LHC8",
    "experiment": "ATLAS",
    "luminosity": 20.3,
    "process": {
        "firstDecay": [
            "emusamesign"
        ],
        "secondDecay": [
            "emusamesign"
        ]
    },
    "analysis": {
        "equalParticleMasses": true,
        "grid": {
            "massFirstParticle": [
                50.3952896033889,
                53.4765213836383,
                56.9638569340879,
                60.2432212137499,
                64.5305506573758,
                68.0151720639978,
                72.9237011761588,
                77.4268050540767,
                82.5056466914177,
                87.62791463,
                93.8056452495289,
                99.7340139048996,
                106.267636633818,
                113.218219708248,
                120.795430738868,
                128.786209435213,
                137.170878254535,
                147.61185029122,
                157.843493985204,
                168.698372955593,
                180.784455419765,
                193.282748477748,
                207.819702818215,
                223.178703470458,
                240.385357533319,
                258.610833335455,
                278.481758833055,
                300.399488044621,
                324.980131619013,
                351.001646297866,
                382.129483320315,
                451.997312997611,
                493.370364433181,
                539.872129898924,
                592.730420208837,
                613.223223910929
            ]
        },
        "limit": {
            "observed": [
                8.20174966623336,
                9.58902661840844,
                9.81056166068414,
                6.93454829537257,
                4.99593041065586,
                5.81871479702718,
                6.75112573428946,
                5.05277347964762,
                4.23984274330865,
                4.20743377682988,
                5.90667006090513,
                5.03247644266287,
                2.95098312683432,
                2.36543751287238,
                2.88385048135504,
                2.78637145010002,
                2.19965878266586,
                1.56661107343213,
                1.15030481309596,
                1.56033626627213,
                1.68376204458497,
                1.13683993302193,
                0.812725449999304,
                0.918037315614238,
                0.863572977939438,
                0.824814001098095,
                0.663594795212782,
                0.665990209202847,
                0.974829891668643,
                0.784242437075767,
                0.580132006133916,
                0.501560984840965,
                0.711983891212342,
                0.450404068648858,
                0.313399891900013,
                0.351303807982049
            ],
            "expected": [
                8.48803495199314,
                9.2303516527816,
                9.62533232761308,
                9.69869758464261,
                8.10739070479277,
                8.20037224409618,
                7.36979884808775,
                6.95989293083119,
                6.49800520841981,
                5.75146873557587,
                5.36972468226986,
                4.9,
                3.85354706636362,
                3.19673084063925,
                3.03037169171544,
                2.99568357707949,
                2.47559602581808,
                2.21627330724249,
                1.8881849968571,
                1.76951365353132,
                1.69019317288812,
                1.65808376174432,
                1.44525222810979,
                1.29379905780118,
                1.20320231070894,
                1.0487224661119,
                0.97898716945949,
                0.889806455999314,
                0.799532635335257,
                0.772374324299037,
                0.61897412965341,
                0.558060550338014,
                0.443784703356388,
                0.376519784501143,
                0.334383249452199,
                0.338163383383516
            ]
        }
    }
}