{
    "limitClass": "PairProductionLimit",
    "id": 14112921,
    "reference": "1411.2921",
    "source": "Fig. 5(b)",
    "citeKey": "ATLAS:2014vih",
    "collider": "LHC8",
    "experiment": "ATLAS",
    "luminosity": 20.3,
    "process": {
        "firstDecay": [
            "mutausamesign"
        ],
        "secondDecay": [
            "mutausamesign"
        ]
    },
    "analysis": {
        "equalParticleMasses": true,
        "grid": {
            "massFirstParticle": [
                100.0,
                150.0,
                200.0,
                250.0,
                300.0,
                350.0,
                400.0,
                450.0,
                500.0,
                550.0,
                600.0
            ]
        },
        "limit": {
            "observed": [
                24.527606629777,
                9.09118906472884,
                6.01603486985082,
                2.51188643150959,
                1.97948276206971,
                1.35217992132282,
                0.976461607582975,
                0.727895384398318,
                0.77563102502742,
                0.77563102502742,
                0.775631025027418
            ],
            "expected": [
                34.5088935216415,
                13.7382379588326,
                9.23670857187386,
                3.85662042116348,
                2.65544879314094,
                1.55992403007499,
                1.35217992132282,
                1.1814457737999,
                1.1814457737999,
                1.20992547441196,
                1.23909170111345
            ]
        }
    }
}