{
    "limitClass": "PairProductionLimit",
    "id": 1710097482,
    "reference": "1710.09748",
    "source": "Fig. 10(b)",
    "citeKey": "ATLAS:2017xqs",
    "collider": "LHC13",
    "experiment": "ATLAS",
    "luminosity": 36.1,
    "process": {
        "firstDecay": [
            "mumusamesign"
        ],
        "secondDecay": [
            "mumusamesign"
        ]
    },
    "analysis": {
        "equalParticleMasses": true,
        "grid": {
            "massFirstParticle": [
                250.0,
                300.0,
                350.0,
                400.0,
                450.0,
                500.0,
                550.0,
                600.0,
                650.0,
                700.0,
                750.0,
                800.0,
                850.0,
                900.0,
                950.0,
                1000.0,
                1050.0,
                1100.0,
                1150.0,
                1200.0
            ]
        },
        "limit": {
            "observed": [
                0.280033,
                0.152404,
                0.116169,
                0.113781,
                0.109267,
                0.112274,
                0.0946878,
                0.0985726,
                0.107352,
                0.114919,
                0.120135,
                0.111594,
                0.110122,
                0.107946,
                0.090376,
                0.08628,
                0.0806032,
                0.0808622,
                0.0797627,
                0.0824655
            ],
            "expected": [
                0.185106,
                0.147185,
                0.129784,
                0.128273,
                0.113743,
                0.118052,
                0.108845,
                0.106415,
                0.100707,
                0.0997365,
                0.0997697,
                0.0949715,
                0.0977738,
                0.100314,
                0.0884002,
                0.0877468,
                0.084837,
                0.0852956,
                0.0849057,
                0.0877341
            ]
        }
    }
}